time,likes,comments,reactions,reaction_count,image,video,link,text,shares,post_url,topic,processed_text,engagement
2023-11-13 00:15:00,3576,22,"{'like': 3576, 'love': 403, 'haha': 1, 'wow': 62, 'care': 21, 'angry': 2}",4065,https://scontent.fhan14-1.fna.fbcdn.net/v/t39.30808-6/402064038_891518965678868_1611649552692769993_n.jpg?stp=cp0_dst-jpg_e15_fr_q65&_nc_cat=107&ccb=1-7&_nc_sid=5f2048&efg=eyJpIjoidCJ9&_nc_ohc=NqI0bXTYbCMAX-Y_2fZ&_nc_ht=scontent.fhan14-1.fna&oh=00_AfCy0dInSUjU1vEjIOVYMImwh1c4FYuM9Ffb3DGiDn5TpQ&oe=656485F1&manual_redirect=1,,,"A boatman guides tourists down the Poxin River as it emerges from underground in Guangxi, China.",148,https://facebook.com/natgeo/posts/891518982345533,Travel,boatman guid tourist poxin river emerg underground guangxi china,4235
2023-11-12 21:15:04,961,56,"{'like': 961, 'love': 165, 'haha': 1, 'wow': 3, 'care': 8, 'sad': 2, 'angry': 1}",1141,,,https://on.natgeo.com/3SzuKtw?fbclid=IwAR3tTy8wDMCNGf6s9eFxZHK0j3MAbkNU2XGlGxVhRGbS_yeXa2qlkpLZKxE,"Observed by more than a billion people across faiths, this five-day festival of lights brings prayer, feasts, fireworks and, for some, a new year.

NATIONALGEOGRAPHIC.COM
Diwali is the Indian festival of lights. Here's what to know about its history and customs.",181,https://facebook.com/natgeo/posts/891428255687939,History & Culture,observ billion peopl across faith festiv light bring prayer feast firework new year diwali indian festiv light know histori custom,1378
2023-11-12 09:15:04,712,34,"{'like': 712, 'love': 104, 'haha': 2, 'care': 12, 'angry': 2}",832,,,https://on.natgeo.com/474pJhh?fbclid=IwAR0UPNxmJYydE1JObKoMDYnAZFYuegdSQKa7JjmuxZftqxpDrrCHKUsSVHU,"""I’d like my work to be a tool to educate and help dismantle stereotypes that have plagued Indigenous peoples since Edward S. Curtis labeled us the ‘vanishing race.’ We haven’t vanished,"" says one photographer.

NATIONALGEOGRAPHIC.COM
Photographers share reflections on their identity during Native American Heritage Month",50,https://facebook.com/natgeo/posts/891151012382330,History & Culture,like work tool educ help dismantl stereotyp plagu indigen peopl sinc edward curti label us vanish vanish say one photograph photograph share reflect ident nativ american heritag month,916
2023-11-12 06:15:35,3152,120,"{'like': 3152, 'love': 799, 'haha': 33, 'wow': 18, 'care': 80, 'sad': 1}",4083,,https://scontent.fhan14-1.fna.fbcdn.net/v/t42.1790-2/17030801_1871145513110252_2263142109349412864_n.mp4?_nc_cat=101&ccb=1-7&_nc_sid=55d0d3&efg=eyJ2ZW5jb2RlX3RhZyI6InN2ZV9zZCJ9&_nc_ohc=8PxZtG8lT4sAX-RNKis&_nc_rml=0&_nc_ht=scontent.fhan14-1.fna&oh=00_AfCkuA2yE9WcQLxLFaDU23guHftIdUG6BgvHllerd1J92A&oe=6564DC69,,Sleeping is the best way for koalas to conserve energy—a good excuse for the next time you need a nap.,331,https://facebook.com/natgeo/posts/890386325792132,Science,sleep best way koala conserv good excus next time need nap,4534
2023-11-12 03:15:00,721,26,"{'like': 721, 'love': 16, 'wow': 4, 'care': 2, 'angry': 1}",744,https://scontent.fhan14-4.fna.fbcdn.net/v/t39.30808-6/400439630_891035639060534_3519720597927776631_n.jpg?stp=cp0_dst-jpg_e15_fr_q65&_nc_cat=111&ccb=1-7&_nc_sid=5f2048&efg=eyJpIjoidCJ9&_nc_ohc=ACS2N-f9Z9oAX9JJtxv&tn=zl8CM8dkYkrsNiwA&_nc_ht=scontent.fhan14-4.fna&oh=00_AfARrdsibDfIHQZ0se-R6DMKzxwju0rIUTyhNWisUhZr_A&oe=6563F6FA&manual_redirect=1,,https://on.natgeo.com/3uet3YE?fbclid=IwAR33fsJqcC5TE6_LfMBObM_S4wuH9kVXjlqE7H8oMj0tf-l4DvEXmQr4KAU,"Love them or loathe them, morning rituals can set the tone for the rest of the day. For centuries, humans have been devising morning routines that inspire productivity and focus. Here’s how these historic figures started their days.
https://on.natgeo.com/3uet3YE",36,https://facebook.com/natgeo/posts/891035659060532,History & Culture,love loath morn ritual set tone rest day centuri human devis morn routin inspir product focu histor figur start day http,806
2023-11-12 00:15:01,12661,287,"{'like': 12661, 'love': 2628, 'haha': 17, 'wow': 251, 'care': 120, 'sad': 3, 'angry': 1}",15681,https://m.facebook.com/photo/view_full_size/?fbid=890974682399963&ref_component=mbasic_photo_permalink&ref_page=%2Fwap%2Fphoto.php&refid=13&_ft_=encrypted_tracking_data.0AY_ZG0zc0zUjkqe4OXJ988d9c55hEyxdbhoe1kxWXKdh55hQsqewKTSBdW7RZjeGbvipMsSDye2CpBYILOXgg-0ZhNYy9cxoiksjZ5kT8DJi7zWLAd-kkL6QBUoJbN3i_gDRpc6pyf8g1aFLZtwgsVvuren1WjY-gyFBs4z0rhyQKnXz_0nGBeHNN7a7g3PEo438QyNd-tJ3i-pbODEFS8fvJGh866ZsOvGRa69__ELDaHncFv7fLmUAmfGCt_V-NUe_JgzXG3gcEc6pcjhbodSXChpQneJdlw7s23OD48cdDTumnNoM5y_ww71XFaAyU2Ulnt-afEmNL4S2snjEH9NYVcvl_OJbhgyCEVTq_toiffjyqUD0K78JLSaxfMK0fclWPzpyLZBQmkd8D8QMGjvxwsHcS021HgBagyWLkgBMyA_07rZeBiVxrvL6P39uC0fISdZesXET7uLn_vJ2sut3Jj0xgie0tkhR7IbDqFSpACqlL-8VuEbdBP2-3Pz-cEYW7_uK67shJr9ZRe1eYuJ1tpJEUTBi8PXa0ghzZv_KCzxjkRl05asYsBHkWUdSmkNHCqfTH9l9F0oYyNHKifPxnQPY-U4mTt-qcjDHd7j2Xw14axSDLcmowv-JN5iKr6uwLevMjPq7g9bN04YWo-PacAlSRhp68giukD0PeU61HgzhIYd73KR3ty-fsoBuPmDkdNyygFfqItsBBCXsk0R6wDHbwXsWpVC7CmgbDJitkt8eMqJwYFp8A2IkMTQ7njhGtJvw8AUl_3EphztUBVlvLfWFpnNA8BS_wL0tZ75AT8yjuQB3H2-paBJCpCw5SA0kx8pgEtM7yCczRfZr9FFD76-fEpMDst_3DJiyuuYVCEozOVsvfUxl95sSIle7hRbJpU4MqJrKjtNTuMBBvOUC0jtPPzaql-1our8tA4FvooH2EFyWkvGgNM8GVwVPWsxRPXDtjzobVVT9m6Jy4yVrKnuRhFpHROi-50OQBEfMIxj-D5_GE5BjKuVBLnXXKgkQLEy-\-\_a2U1fn_WCutTl16-AgcThdOCuZDh1RqpHE9N9ALYGtcRkHqwgPQgFb6HEnaJ8LhOSwbIgKOksR-Q_tYPhfNOP6-377253gFnpSZ9LGCD7tqXZYZsU0C_ryjUSfd_ZzXrG0urQJiCmSUqH2TJb5KitJueu81QUklqAJrIYypkWxmwgub1wohuHTs2pEffL7SrDjFU-kfEH3dXsbS1HXETp-C2cgeqf6QM0MohCJLWTwfpIjGy3-qjmsBslWri6O8BMhq4Fwo6_G1VHKkUPTF6GL1SuMGp3AjwLd2WprNRQvCpFccLOMLdhpYOjxRlcqjfv4q9wPzmVaXdLI-67CfMoBX-YvVy8Bd6n7DrxllImXboPqyXfxPMNI4mhlBVEP8I2WfQ7CzqvPA0Xo8IlIQc_O61OdH3ZM-JMlqEgeVdvhBdk-RHDEhxnbX7NkUzhEADA&__tn__=%2Cg&paipv=0&eav=AfaoPT4-jKbuPt7Swt_u0ykMJwJpSZhzDkYHdqA55KeMyxKNG8aapUpFfFkbMQviByg,,,"Brown bears wait for sockeye salmon to jump at Brooks Falls in Katmai National Park, Alaska.",1000,https://facebook.com/natgeo/posts/890974719066626,Animals,brown bear wait sockey salmon jump brook fall katmai nation park alaska,16968
2023-11-11 21:15:04,908,32,"{'like': 908, 'love': 50, 'haha': 1, 'wow': 28, 'care': 14, 'sad': 2}",1003,,,https://on.natgeo.com/47mELyk?fbclid=IwAR1NjLr7-edXKgh6xOFg9slUmGdvIo056DfOudogjfyEFG9acqD7xnylKK4,"Javelinas have joined the ranks of deer, skunks, raccoons, and coyotes: They aren’t living on the edge of our urban communities anymore, but solidly in them.

NATIONALGEOGRAPHIC.COM
What to know about javelinas",56,https://facebook.com/natgeo/posts/890896642407767,Animals,javelina join rank deer skunk raccoon coyot live edg urban commun anymor solidli know javelina,1091
2023-11-11 18:15:04,270,14,"{'like': 270, 'love': 38, 'wow': 3, 'care': 41, 'sad': 4, 'angry': 1}",357,,,https://on.natgeo.com/3QR0OIf?fbclid=IwAR0NBDZO2EeIRQi72ErqYkvWVDr-8l4fnpYUaTG9sBdaYYRC3lehpoHbS7M,"The 65th Infantry Regiment—also known as ""The Borinqueneers""—faced racism and xenophobia from their military counterparts even as they risked their lives for America.

NATIONALGEOGRAPHIC.COM
This all-Hispanic Army unit fought in the Korean War. Here's one veteran's story.",48,https://facebook.com/natgeo/posts/890820689082029,History & Culture,infantri known borinquen racism xenophobia militari counterpart even risk live america armi unit fought korean war one veteran stori,419
2023-11-11 12:15:05,409,9,"{'like': 409, 'love': 13, 'haha': 1, 'wow': 2, 'care': 2, 'angry': 1}",428,,,https://on.natgeo.com/3FSmgWP?fbclid=IwAR2K2WwU35aVoL2XMux9iKmENu-O69w7Ng1VbYmYedAoBlZtmu1VIghk20Q,"New hotels are appearing apace in Mumbai, while older ones are constantly upping their game. Here are 10 of the best.

NATIONALGEOGRAPHIC.COM
10 of the best hotels in Mumbai, from Indian opulence to Soho House socials",13,https://facebook.com/natgeo/posts/890649455765819,Travel,new hotel appear apac mumbai older one constantli up game best best hotel mumbai indian opul soho hous social,450
2023-11-11 09:15:04,1619,34,"{'like': 1619, 'love': 162, 'haha': 3, 'wow': 26, 'care': 8, 'sad': 1, 'angry': 2}",1821,,,https://on.natgeo.com/3MFbRlb?fbclid=IwAR1jsLqnj69ZzBj4sGBML17LVV1mUK3rVi821jGKOm-gyTy5Wcl-SvKf3PQ,"The Alhambra embodies the architectural golden age of Muslim rule on the Iberian Peninsula. We were given access to its darkest recesses, where tourists aren’t allowed.

NATIONALGEOGRAPHIC.COM
See Spain's fabled Alhambra as few have ever before",107,https://facebook.com/natgeo/posts/890551095775655,History & Culture,alhambra embodi architectur golden age muslim rule iberian peninsula given access darkest recess tourist allow see spain fabl alhambra ever,1962
2023-11-11 06:15:32,2611,98,"{'like': 2611, 'love': 88, 'haha': 251, 'wow': 126, 'care': 21, 'sad': 2}",3099,,https://scontent.fhan14-2.fna.fbcdn.net/v/t42.1790-2/21164467_452814165101830_4014423356529967104_n.mp4?_nc_cat=100&ccb=1-7&_nc_sid=55d0d3&efg=eyJ2ZW5jb2RlX3RhZyI6InN2ZV9zZCJ9&_nc_ohc=yDWlNmQIe8kAX_rPaqZ&_nc_rml=0&_nc_ht=scontent.fhan14-2.fna&oh=00_AfAwi70wMpkVjP2P1w-Ig0oVsjydGQCik8jECEb_DYudIA&oe=6563B913,,Male seagulls have a strange way of signaling that they're ready to mate.,125,https://facebook.com/natgeo/posts/890385495792215,Environment,male seagul strang way signal readi mate,3322
2023-11-11 04:15:01,2679,781,"{'like': 2679, 'love': 109, 'haha': 418, 'wow': 521, 'care': 15, 'sad': 6, 'angry': 2}",3750,https://m.facebook.com/photo/view_full_size/?fbid=890460885784676&ref_component=mbasic_photo_permalink&ref_page=%2Fwap%2Fphoto.php&refid=13&_ft_=encrypted_tracking_data.0AY8O8KBwPCtRHpeF1VXMnvnctP2EqVMFrBFYOvprExCALT95jHG8lZA3Y92QOQLnyW4ZCMPKNjyVaI_DEvQcw0uwVxlQPeU4eKJWcaTQp6cXdYxZxbKFEniL6Gch0j5iApASTqvhM9Ss9QIR82593rBjGu7liUFUag4mA84jOpwNeJALAfloz_0PTBIklDWiVBNPXCPNNMAcHXgHVPUummUdvgflu0-W3ZWlc489D9OT3VwZ4I6OtBlFo_3ROuTGrqrfnYRGa6Gmdxj52qXzEJt_NCVOLJFO2NutQE-zsY-Sb_PalW92lbIq5aI1mROee0lDoFdtu9zu14tIAhXU0jyMzdSfZaVjqfQT8FLOa9iK_8GJPFfSv-uj1GnPGLgH244sovBZqwa9gmoXW74lrDe7_NlCzSjJBV6s5ZWKPs90O6BEeIw3vJsqKMqDbJVPeIwplRJqUzK91_uKd1tvLAaqIqhIZsKgaxhAKGk-LMxksQef_qCfHA68y-\-\zbQneDeQ2IhOypzOnyyL6HsExhxJlGddpVX7NDym__hATSu1w2kCqdxUXOAU5_vabyA1w6CIi0aOhGlToPbWxiJoSyDRmie5I5Tn5SygKByZBcJ_gKXfCF0ZMKctw0-JR2hzW0wIwSKgSaAcctGke4UZm8RVyuMFFMzZwiJgdTOKYb0Wmqc3XWCakTHpwzVHHN5g13ox8PHcscahsshPlYhbJQRNLXFZdN6r8tpBDDGTUE-aURME1R4DHblaDZ1yLXSTruHWE3xbd-j3AoI2BBAvYQ8wBaoeHb2NIEKNDCt6eQJI4dZfupwmoxFk5ZIkcnI7HBGyheoUFqnY0CglbQk6VPyd1eyKAtNkII_XGy0NyZRL3yFElNa1_Nxi_Rc-gaeeb9KkqPlQsjlrWdcvz7fHwP-xCONj5BcO-ofSxScMCfJe_wkWry8BwQcBznC5XN3_yBYnxjTtxS8fsbo1HWAMHT6XahZSeBxkd6DlGAFdWwHstjc7-UtoL6CMhJ0y1zuQgxQDD8Hrj7n1lty_TXSqtWjbd_MMOjIB7UpbMqW6Xdauu5k6pHucOrqLljg4PWrO6fzSmRcyHRKDZnzeyN3xbKaoVtxAShAD1Q5HdEljxyXKzZaOQe9TX9Ks2g1-mVwvK94UDXgwKvI1D_6tfZPAHPzdnjrTt-hhPUSk_68L6difcIQGcqUfMCT3c9I-s9gkWYG-167Y7hpKp2wDFC9L5ua516DsmrUjzn0M_e_nmM0usltfawuFmT3-qhfhX1nnOumfNAIkJUdD1OgtqTXXtTigua5Wh9WlTjTSEd87dYDK8-6DgjTKt0ILLoWMygFuIUU6o6AZhrDDXU3_mrJdb_IaWSHBM6AxCwzWDA11BxGkL7l_jUUaytRIZqo9hUXPb9TzVoUvTnSgaa71Uy7-18Uuj0zMbW11RJfqbk4M62pKF02-rCbK054pamwn_63bA7fiDPqrvCdXG&__tn__=%2Cg&paipv=0&eav=AfYKpGp5Uo-EAgSOToKLPwKx-YeT_fEXCgko2uowH3BiDGxj-bjEjjQOCcvp5rS3Csw,,https://on.natgeo.com/478n6e7?fbclid=IwAR1Skok_qP_G4CJuY4wCx8VYxE41kpU4S4c-pgFXpiPHJSFakWlGwDYXLVM,"Some 4.5 billion years ago, a Mars-size object called Theia smashed into Earth, and the debris coalesced into the moon. Now, a new study suggests that portions of Theia survived throughout Earth's history deep in our planet's mantle.
https://on.natgeo.com/478n6e7",433,https://facebook.com/natgeo/posts/890460902451341,Science,billion year ago object call theia smash earth debri coalesc moon new studi suggest portion theia surviv throughout earth histori deep planet mantl http,4964
2023-11-11 02:15:04,456,32,"{'like': 456, 'love': 27, 'haha': 5, 'wow': 4, 'care': 77, 'sad': 120}",689,,,https://on.natgeo.com/3MF4w5g?fbclid=IwAR30ujlo-nkuOPF2xNFsbTz4PflDSdf6hIbVI8gpELr27i0JlXMDLzn31do,"Astronaut Frank Borman, who flew on the Apollo 8 mission that orbited the moon, has died. He was 95.

Revisit our 2019 interview with Borman, in which he narrated a gripping account of the space race and shared his thoughts on the future of space exploration.

NATIONALGEOGRAPHIC.COM
Apollo 8's commander reflects on the sights and sounds of the space age",25,https://facebook.com/natgeo/posts/890423329121765,Science,astronaut frank borman flew apollo mission orbit moon die revisit interview borman narrat grip account space race share thought futur space explor apollo command reflect sight sound space age,746
2023-11-11 00:15:00,5564,108,"{'like': 5564, 'love': 639, 'haha': 8, 'wow': 40, 'care': 25, 'sad': 1, 'angry': 1}",6278,https://m.facebook.com/photo/view_full_size/?fbid=890380592459372&ref_component=mbasic_photo_permalink&ref_page=%2Fwap%2Fphoto.php&refid=13&_ft_=encrypted_tracking_data.0AY-KgxCKLesAEH1lTyv5LauwWIot-wAwKpE_UtuqGXOQp0EUHFlBzM_0Smq_6rZ9-AdZ09TdEfUC0dkfe2tcCKPsPvaCTwczU-56SVUE-Ct28x69uUNG0W2w9VcX5Y3-LzS0ZpPrRfJZHVfn78qEEQRuVq6VaE4_Pek3xLUR0MvDngi4F5vZ6y9hSEW77eLbZn00Cs29rSuaDvRkLYa5wL-vjj5SbrgiSlQXmV_ssH0rdzlmhI4EcrjaC5CS08s0aSMB6lo9L_5c-LLB2C9NY1sp12Ly0EfDkkKM8FfpZw-nDtNcemtJ34z4BzkF7KnMCMtOVrrjK9fcCQ4iGygqp0QuZs9srlnCs9nFe1pKSE4Rsn8nTrWytxGVkIkls-ei8Xtf1Gjtr9e2eThNMIG7OP2o-gGjMVVm3EXWztzt5S89A88_fpAM8qHLbHYO7WFElZ_7kW8sTxiBphazVZDh4wf5MFJPWnewXoftzDul1PvnX0SKicVooiCOX-US_mk_QZw1xOOPcvprdNZNAJWbcIvDldW1EDe-ipxY47-CcjzFj_320_QOGzIq6piKFhBi1MFEXHOjHp8wkHRBvapBkHj5u6K92qYSuTxFjhGr8BLTuAT8lDVEJWq-ra-9OxWzDqdroQ8gDohaq_v-71dTU7sFbenay7xs7Sa-ICoH2rK2QExQhJj6ITXqnc6LDhUAlY1GrvMsqmhVPO5YW_mfX_blS42tkKEGuDFfj6eb4mpDCSssXLzrj1bJBCZ2pTMibCOwP1jgpZI43triks6PboLMuvqSsi-_yeKnNW65dKrIpla_GKugUK2ipt5Gl3P2krMuRtLpDMHfDOGSOcmthHp4xGz0DmyyhTfk-2gHCNqLxvjWv9Mid5dJaQQ3lcJu9MpeLdFHF5atGrQdeGT0qJsuDOnpCd-FTEHInFbdJlOHc2hooHcNJ7cBEe0Zv-VIrwrbYS5_wlMqC3aJlt9G6Sn7rljvdvX3dFFiplAirOoJg_ynL4kK5g97lXG6HDC3suRH4rWpYhlRq_6ZuMniseM9Spu7msp_xOKlwfSRDjO4KDuSpQdPMAVRK8glai0L2Z8_CJOfj006tnZi8zBzZjd9B7V0lqvHDaX411-7Y7sH25mi61BM2N0o1Zp_qgeLAtoXrzQjEZk5YU-fwt1YwlX-i0onXEBMivH64b_AWX6uoHSOu5rzG5n0wM7cBzCAlLmy1iyxf2G6K-EGNZizstwbzL6rDQDm3bP5POyBSCIoIOoz8pckf-GoUeFTpmuiOFaMoJbye32QMrVadZ4txmSsmYuoVQrt00oBpEjEuDLyXxGhDEHN9jcuP7n1Kd5cb78xpRqi-\-\0wUgmI4X7AJYcMW_m5b34AqccG5e25xHflqNwH2X-wCP8lHFcu2jh9EplHRVxjpmFsodAdEBVJc06XaRlOKRfiWbu51feCVw5O9qW7411ed2Ea26I7stHrTkfJOUT0XLk&__tn__=%2Cg&paipv=0&eav=AfYxEoHtUj5mux3i4Id4jqyGyRdBFU7vrJ-Qq5NbqV8VU3hdZ_seKEov0fLvxgBS1bI,,,Ancient Moai statues dot a hillside on Rano Raraku crater on Easter Island.,242,https://facebook.com/natgeo/posts/890380615792703,Travel,ancient moai statu dot hillsid rano raraku crater easter island,6628
2023-11-10 21:15:04,1004,16,"{'like': 1004, 'love': 83, 'haha': 1, 'wow': 12, 'care': 2, 'sad': 3}",1105,,,https://on.natgeo.com/461XmPi?fbclid=IwAR1dZKLmhBmLpRhG4nBFSV76azTJWvkL_ZjzAcoMgMUrRYWt9NW3v_QaVkc,"They’re some of the coldest, windiest places in the world, but life has evolved to thrive in these icy environments.

NATIONALGEOGRAPHIC.COM
See the otherworldly beauty of Earth's polar regions",43,https://facebook.com/natgeo/posts/890302905800474,Photography,coldest windiest place world life evolv thrive ici environ see otherworldli beauti earth polar region,1164
2023-11-10 18:15:04,340,47,"{'like': 340, 'love': 9, 'wow': 5, 'care': 16, 'sad': 204, 'angry': 186}",760,,,https://on.natgeo.com/49s4DLf?fbclid=IwAR0GRfOnZjTXNs42ixQAIjmn_B5T5Eo8TC7du7KdfLri9k0Te7qZcYlfxDA,"Some primatologists say the practice is bad for the animals and many tourists aren’t that interested in the monkey tricks, but the macaques' handlers say they’re preserving a unique part of Morocco’s culture.

NATIONALGEOGRAPHIC.COM
These macaques are used for entertaining. They're also endangered.",50,https://facebook.com/natgeo/posts/890224049141693,Animals,primatologist say practic bad anim mani tourist interest monkey trick macaqu handler say preserv uniqu part morocco cultur macaqu use entertain also endang,857
2023-11-10 12:15:08,509,8,"{'like': 509, 'love': 32, 'wow': 5, 'care': 1, 'sad': 1}",548,,,https://on.natgeo.com/49whn3y?fbclid=IwAR2lkWTx5Yl2Nxxed3ZnC9D7iz-BfBh-KoPPQiKwYfYHtQQ3tPmRG94-HC4,"Hotel openings and the new Ghibli Park have reinvigorated this Japanese city.

NATIONALGEOGRAPHIC.COM
Where to stay in Nagoya, the Japanese city reinvigorated by Studio Ghibli",16,https://facebook.com/natgeo/posts/890106822486749,Travel,hotel open new ghibli park reinvigor japanes citi stay nagoya japanes citi reinvigor studio ghibli,572
2023-11-10 09:15:03,301,18,"{'like': 301, 'love': 6, 'wow': 2, 'care': 6, 'sad': 1}",316,,,https://on.natgeo.com/3QSWus3?fbclid=IwAR2uY2KPyhH0kZSXMLgnP0TQ14eGHni4ivw8KVDkm1ubQc4g_thk6I_16I8,"The new guidelines recommend cancer screenings even if smokers quit decades ago. That’s because early detection and new therapies can boost survival.

NATIONALGEOGRAPHIC.COM
There's new guidance on lung cancer screening. Here's who is affected.",28,https://facebook.com/natgeo/posts/890022735828491,Science,new guidelin recommend cancer screen even smoker quit decad ago earli detect new therapi boost surviv new guidanc lung cancer screen affect,362
2023-11-10 06:15:07,3096,48,"{'like': 3096, 'love': 385, 'haha': 1, 'wow': 269, 'care': 28, 'sad': 1}",3780,,https://scontent.fhan14-1.fna.fbcdn.net/v/t39.25447-2/370844796_991750112089606_3438725869218844715_n.mp4?_nc_cat=101&vs=c84da797a8c5f3ea&_nc_vs=HBksFQAYJEdIeWtHaFlHRmlQUi1ZVURBQ3RRdkhyMXpyZ3ZibWRqQUFBRhUAAsgBABUAGCRHSDVzTFFGeUM4N1M1U2tCQUFBQUFBQzNhZ0JtYnY0R0FBQUYVAgLIAQBLB4gScHJvZ3Jlc3NpdmVfcmVjaXBlATENc3Vic2FtcGxlX2ZwcwAQdm1hZl9lbmFibGVfbnN1YgAgbWVhc3VyZV9vcmlnaW5hbF9yZXNvbHV0aW9uX3NzaW0AKGNvbXB1dGVfc3NpbV9vbmx5X2F0X29yaWdpbmFsX3Jlc29sdXRpb24AHXVzZV9sYW5jem9zX2Zvcl92cW1fdXBzY2FsaW5nABFkaXNhYmxlX3Bvc3RfcHZxcwAVACUAHIwXQAAAAAAAAAAREQAAACau89za0%2B2JJBUCKAJDMxgLdnRzX3ByZXZpZXccF0BGrCj1wo9cGDlkYXNoX2k0bGl0ZWJhc2ljXzVzZWNnb3BfNDgwX2NyZl8yOF9tYWluXzMuMF9mcmFnXzJfdmlkZW8SABgYdmlkZW9zLnZ0cy5jYWxsYmFjay5wcm9kOBJWSURFT19WSUVXX1JFUVVFU1QbCogVb2VtX3RhcmdldF9lbmNvZGVfdGFnBm9lcF9zZBNvZW1fcmVxdWVzdF90aW1lX21zATAMb2VtX2NmZ19ydWxlCnNkX3VubXV0ZWQTb2VtX3JvaV9yZWFjaF9jb3VudAg1MDcxNTcxNBFvZW1faXNfZXhwZXJpbWVudAAMb2VtX3ZpZGVvX2lkDzcxMDIyMzY0MDcwMjkzOBJvZW1fdmlkZW9fYXNzZXRfaWQRMTAxNTQ3NzQyMTE4OTM5NTEVb2VtX3ZpZGVvX3Jlc291cmNlX2lkETEwMTU0Nzc0MjExODI4OTUxHG9lbV9zb3VyY2VfdmlkZW9fZW5jb2RpbmdfaWQPMTA5MjA3NzY4OTQ3NjA0DnZ0c19yZXF1ZXN0X2lkACUCHAAlvgEbB4gBcwQ5MzQxAmNkCjIwMTctMDctMDIDcmNiCDUwNzE1NzAwA2FwcA5DcmVhdG9yIFN0dWRpbwJjdBlDT05UQUlORURfUE9TVF9BVFRBQ0hNRU5UE29yaWdpbmFsX2R1cmF0aW9uX3MGNDUuMjQ4AnRzFHByb2dyZXNzaXZlX29yZGVyaW5nAA%3D%3D&ccb=1-7&_nc_sid=d9603c&efg=eyJ2ZW5jb2RlX3RhZyI6Im9lcF9zZCJ9&_nc_ohc=3mG77rst000AX9z3DLw&_nc_rml=0&_nc_ht=scontent.fhan14-1.fna&oh=00_AfDvx72zU6cqyui3j0zrCyi4ibJU17yZTu176F4_PBERsA&oe=6563AC2D&_nc_rid=873052943428792&_nc_store_type=0,,"This flower is open for only six days, but it doesn't just pollinate with anyone.",321,https://facebook.com/natgeo/posts/889890122508419,History & Culture,flower open six day pollin anyon,4149
2023-11-10 04:15:04,283,15,"{'like': 283, 'love': 8, 'haha': 5, 'care': 2, 'sad': 1, 'angry': 1}",300,,,https://on.natgeo.com/3SA94NT?fbclid=IwAR2NeR2cxy6Ren2b6xNaOxKhIqKGEi2XmuFih9a448s-6fJQp3wxK2PNBIM,"We all know that vitamins are critical for our health, but how did they get their names and, more importantly, when were they discovered in the first place?

NATIONALGEOGRAPHIC.COM
Why is there a Vitamin K but no Vitamin F?",22,https://facebook.com/natgeo/posts/889930735837691,Science,know vitamin critic health get name importantli discov first place vitamin k vitamin f,337
2023-11-10 02:15:04,766,46,"{'like': 766, 'love': 126, 'haha': 5, 'wow': 30, 'care': 17, 'sad': 1}",945,,,https://on.natgeo.com/47nOWCU?fbclid=IwAR0gonEtVbXmAPi3BmYl2zhX5sSz4qS_RE-Xgnysfs456e7g0WECKQniATs,"Cats have 276 distinct facial expressions according to a new study, dispelling the myth that our pet felines are aloof and just not that into us.

NATIONALGEOGRAPHIC.COM
Cats have 276 facial expressions. Why?",102,https://facebook.com/natgeo/posts/889888952508536,Animals,cat distinct facial express accord new studi dispel myth pet felin aloof us cat facial express,1093
2023-11-10 00:15:00,3682,75,"{'like': 3682, 'love': 916, 'haha': 2, 'wow': 5, 'care': 137, 'sad': 23}",4765,https://scontent.fhan14-2.fna.fbcdn.net/v/t39.30808-6/398990882_889844925846272_7396444808722448458_n.jpg?stp=cp0_dst-jpg_e15_fr_q65&_nc_cat=100&ccb=1-7&_nc_sid=5f2048&efg=eyJpIjoidCJ9&_nc_ohc=pqI8rqSUVo8AX8PAkF9&_nc_ht=scontent.fhan14-2.fna&oh=00_AfANnVhKtBPDNAPoJchYXKdxXjxJx5ItqyW1UZqSYm8yUg&oe=6565016D&manual_redirect=1,,,"A harp seal mother and pup bond on a greatly diminished ice pack in the Gulf of Saint Lawrence, Quebec, Canada in this image from our archives.",240,https://facebook.com/natgeo/posts/889844949179603,Animals,harp seal mother pup bond greatli diminish ice pack gulf saint lawrenc quebec canada imag archiv,5080
2023-11-09 21:15:04,572,42,"{'like': 572, 'love': 6, 'haha': 1, 'wow': 14, 'care': 5, 'sad': 1}",599,,,https://on.natgeo.com/46ZDr4O?fbclid=IwAR0K60GErN6GTMM3pVslyBZRO5_TSEZxH4j5yq_0Mne0vkvpkk5bz2Fi7rU,"Though animal attacks are rare, certain human activities can trigger or help prevent them. These expert tips could save your life—whether you're on the trail or in your own backyard.

NATIONALGEOGRAPHIC.COM
What to do if you're attacked by a bear-or any of these other wild animals",37,https://facebook.com/natgeo/posts/889768732520558,Animals,though anim attack rare certain human activ trigger help prevent expert tip could save trail backyard attack wild anim,678
2023-11-09 18:15:03,527,17,"{'like': 527, 'love': 7, 'wow': 2, 'care': 3}",539,,,https://on.natgeo.com/3FT6b3a?fbclid=IwAR0X5b2oVIekl32gh5EGHtkyhIaB-sovlClKbKCKCPiYPAQo-HUkSE5DI_k,"Modern-day life coaches and trendsetters continuously engineer new ways to optimize hours in the day, but their impulse is nothing new. These historical figures had serious opinions on how to start the morning right.

NATIONALGEOGRAPHIC.COM
What's the best morning routine? History may have the answer.",31,https://facebook.com/natgeo/posts/889692132528218,History & Culture,life coach trendsett continu engin new way optim hour day impuls noth new histor figur seriou opinion start morn right best morn routin histori may answer,587
2023-11-09 12:15:05,274,16,"{'like': 274, 'love': 20, 'haha': 1, 'wow': 4, 'care': 2, 'sad': 1}",302,,,https://on.natgeo.com/3st8tmM?fbclid=IwAR1-4NqtyjKAsLYVmAr-xoPOyDzIJYLbeKjhB7XlcsK8igfb-BTg3hoCHSI,"Dubious claims are out there of leaky gut causing diseases from depression to autoimmune disorders. Experts weighed in on why that may not be the case.

NATIONALGEOGRAPHIC.COM
Is 'leaky gut' real? It's more complicated than you'd think.",20,https://facebook.com/natgeo/posts/889578362539595,Science,dubiou claim leaki gut caus diseas depress autoimmun disord expert weigh may case gut real complic think,338
2023-11-09 09:15:03,568,368,"{'like': 568, 'love': 12, 'haha': 243, 'wow': 6, 'care': 5, 'angry': 5}",839,,,https://on.natgeo.com/47nhfBA?fbclid=IwAR3C0X5uqpqbJejd1msECHF8ZPrl5VYV6FyJjeeWJibUnlppZaFAysioKyo,"If you’re purchasing and putting on a piece of clothing that represents a particular place or people, there’s a fine line between cultural appreciation and cultural appropriation. Here are five cultures that invite you to dress up and join the party.

NATIONALGEOGRAPHIC.COM
It's OK to wear an Aloha shirt. Here's what culturally conscious travelers should know",59,https://facebook.com/natgeo/posts/889524419211656,Travel,purchas put piec cloth repres particular place peopl fine line cultur appreci cultur appropri five cultur invit dress join parti ok wear aloha shirt cultur consciou travel know,1266
2023-11-09 04:15:00,896,101,"{'like': 896, 'love': 11, 'care': 9, 'haha':10, 'wow': 192,'sad':6,'angry':4}",1100,,,https://www.nationalgeographic.com/premium/article/tegu-lizards-invasive-spreading-southeast-united-states?cmpid=org=ngp::mc=social::src=facebook::cmp=editorial::add=fb20231108animals-tegulizards&linkId=247065142&fbclid=IwAR2yYF_vli9WSUMQEWkxkgFSPw7bP6eKhBIWNeK-pTUBy5VH_jT1B_0TLaE,"Argentine black-and-white tegus are breeding in multiple states, posing a threat to native species. But recent efforts to trap them may be paying off. ~ NATIONALGEOGRAPHIC.COM A dog-sized lizard is threatening the U.S South. Can it be stopped?",68,https://facebook.com/natgeo/posts/897234058440692,Animals,argentin tegu breed multipl state pose threat nativ speci recent effort trap may pay lizard threaten south stop,1269
2023-11-09 03:15:00,2000,46,"{'like': 2000, 'love': 201, 'care': 19, 'haha':2, 'wow': 302,'sad':0,'angry':0}",2500,,https://scontent.fhan14-2.fna.fbcdn.net/v/t42.1790-2/405274195_314640558181314_8816362127736519239_n.mp4?_nc_cat=106&ccb=1-7&_nc_sid=55d0d3&efg=eyJ2ZW5jb2RlX3RhZyI6InN2ZV9zZCJ9&_nc_ohc=m4lrTHTeKtUAX_MkT3Y&_nc_rml=0&_nc_ht=scontent.fhan14-2.fna&oh=00_ ,,"At the microscopic level, soil from Germany's Black Forest is a fantastical realm-one that's mirrored in wooded ecosystems worldwide. Here's how we photographed microscopic creatures hidden in the forest's soil.",224,https://facebook.com/natgeo/posts/897234058440692,Environment,microscop level soil germani black forest fantast mirror wood ecosystem worldwid photograph microscop creatur hidden forest soil,2770
