time,likes,comments,reactions,reaction_count,image,video,link,text,shares,post_url,topic,processed_text,engagement
2023-11-30 21:15:00,383,6,"{'like': 383, 'love': 11, 'care': 2, 'haha':1, 'wow': 0,'sad':0,'angry':0}",397,,,https://www.nationalgeographic.com/history/article/periods-menstruation-women-history-ancient-egypt?cmpid=org=nap::mc=social::src=facebook::cmp=editorial::add=fb20231130hist-periodproducts&linkId=251822244&fbclid=IwAR3thGOEHeSbIAIgtwz4uCu5fKLx6KFSY4TGvJWi8dGRaaq7e6fZXziwH5Q,How we've dealt with periods over millennia says a lot about our societies-and the persistent stigma surrounding menstruation. ~ NATIONALGEOGRAPHIC.COM Egyptions used papyrus-and other ways of handling periods through the years,15,https://facebook.com/natgeo/posts/897234058440692,History & Culture,dealt period millennia say lot persist stigma surround menstruat egypt use way handl period year,418
2023-11-30 18:15:00,675,20,"{'like': 675, 'love': 46, 'care': 4, 'haha':2, 'wow': 3,'sad':0,'angry':0}",730,,,https://www.nationalgeographic.com/environment/article/wild-river-national-park-vjosa-albania?cmpid=org=ngp::mc=social::src=facebook::cmp=editorial::add=fb20231130env-resurfvjosaalbania&linkId=251824802&fbclid=IwAR3thGOEHeSbIAIgtwz4uCu5fKLx6KFSY4TGvJWi8dGRaaq7e6fZXziwH5Q,What will it take the save the world's rivers? Experts say we need only look to the Vjosa River in Albania for a model of conservation. ~ NATIONALGEOGRAPHIC.COM How Vjosa Wild River National Park was created-and sparked a movement,35,https://facebook.com/natgeo/posts/897234058440692,Environment,take save world river expert say need look vjosa river albania model conserv vjosa wild river nation park spark movement,785
2023-11-30 12:15:00,710,12,"{'like': 710, 'love': 41, 'care': 0, 'haha':2, 'wow': 1,'sad':0,'angry':0}",754,,,https://www.nationalgeographic.com/travel/article/best-north-american-ski-resorts?cmpid=org=nap::mc=social::src=facebook::cmp=editorial::add=fb20231130travel-northamericanskiing&linkId=251824753&fbclid=IwAR2SzAeGUCR45ei7_TXD7FBgfhlzs44BkTvDhEn0BizrwJKEzQ7EhICghgA,"North America is becoming a more popular winter sports destination as resorts link areas, expand lift networks and unveil enticing new activities. ~ NATIONALGEOGRAPHIC.COM Where to go for a NORTH American ski adventure",15,https://facebook.com/natgeo/posts/897234058440692,Travel,north america becom popular winter sport destin resort link area expand lift network unveil entic new activ go north american ski adventur,781
2023-11-30 09:15:00,501,22,"{'like': 501, 'love': 46, 'care': 5, 'haha':1, 'wow': 1,'sad':0,'angry':0}",554,,,https://www.nationalgeographic.com/premium/article/mobility-walking-health-exercise-technique?cmpid=org=nap::mc=social::src=facebook::cmp=editorial::add=fb20231129science-mobility&linkId=251795297&fbclid=IwAR1MkHzyM3lHRZb9iRdzGX08ZPIEqhSeD6gCSr6ckmL8nbHt1xCkXpwHZ2o,Experts have one key piece of advice for our aging bodies: Don't stop moving. ~ NATIONALGEOGRAPHIC.COM Walking is the sixth vital sign. Here's how to do it right.,68,https://facebook.com/natgeo/posts/897234058440692,Science,expert one key piec advic age bodi stop move walk sixth vital sign right,644
2023-11-30 06:15:00,6800,357,"{'like': 6800, 'love': 2100, 'care': 107, 'haha':197, 'wow': 133,'sad':2,'angry':1}",9400,,https://scontent.fhan14-2.fna.fbcdn.net/v/t42.1790-2/405274195_314640558181314_8816362127736519239_n.mp4?_nc_cat=106&ccb=1-7&_nc_sid=55d0d3&efg=eyJ2ZW5jb2RlX3RhZyI6InN2ZV9zZCJ9&_nc_ohc=m4lrTHTeKtUAX_MkT3Y&_nc_rml=0&_nc_ht=scontent.fhan14-2.fna&oh=00_ ,,A traffic cam along I-94 in Minnesota captured this very fine footage of a hawk staring deeply into the lens. The bird was identified as a red-tailed hawk by the Minnesota Department of Natural Resources.,1000,https://facebook.com/natgeo/posts/897234058440692,Animals,traffic cam along minnesota captur fine footag hawk stare deepli len bird identifi hawk minnesota depart natur resourc,10757
2023-11-30 04:15:00,564,13,"{'like': 564, 'love': 36, 'care': 10, 'haha':0, 'wow': 7,'sad':1,'angry':0}",618,,,https://www.nationalgeographic.com/animals/article/woolly-bear-caterpillar-winter-weather?cmpid=org=nap::mc=social::src=facebook::cmp=editorial::add=fb20231129animals-woollybearcaterpillar&linkId=251795152&fbclid=IwAR130tXwRgODe1i6w9N4Rvpzp4IQ-RpGabq4lIInnVG2aQP7yV5_IWmEx4U,"Can the black hairs of this woolly bear caterpillar really tell us how mild or severe winter will be? The folklore has been passed down for centuries, but experts say it's unlikely. ~ NATIONALGEOGRAPHIC.COM Are these fuzzy caterpillars really winter weather oracles?",15,https://facebook.com/natgeo/posts/897234058440692,Animals,black hair woolli bear caterpillar realli tell us mild sever winter folklor pass centuri expert say unlik fuzzi caterpillar realli winter weather oracl,646
2023-11-30 02:33:00,1300,35,"{'like': 1300, 'love': 40, 'care': 9, 'haha':3, 'wow': 233,'sad':0,'angry':0}",1600,,,https://www.nationalgeographic.com/premium/article/buffalofish-oldest-hundred-years-mystery?cmpid=org=nap::mc=social::src=facebook::cmp=editorial::add=fb20231128animals-buffalofish&linkId=251792551&fbclid=IwAR3thGOEHeSbIAIgtwz4uCu5fKLx6KFSY4TGvJWi8dGRaaq7e6fZXziwH5Q,"Buffalofish live their best lives into their upper 80s and 90s, with better stress response and immune function than younger individuals. What can humans learn from them? ~ NATIONALGEOGRAPHIC.COM These fish live up to 100-and get healthier as they age",94,https://facebook.com/natgeo/posts/897234058440692,Animals,buffalofish live best live upper better stress respons immun function younger individu human learn fish live get healthier age,1729
2023-11-30 00:22:00,5400,120,"{'like': 5400, 'love': 1200, 'care': 44, 'haha':1, 'wow': 145,'sad':2,'angry':0}",6800,https://scontent.fhan14-4.fna.fbcdn.net/v/t39.30808-6/404671332_896385718525526_7445082065366036712_n.jpg?stp=cp0_dst-jpg_e15_fr_q65&_nc_cat=111&ccb=1-7&_nc_sid=5f2048&efg=eyJpIjoidCJ9&_nc_ohc=dJEWXCnhX5oAX-UcHMJ&tn=zl8CM8dkYkrsNiwA&_nc_ht=scontent.,,,Happy International Jaguar Day! A jaguar leaps into a river in pursuit of a caiman in Brazil's Pantanal in this image from our archives.,578,https://facebook.com/natgeo/posts/897234058440692,Environment,happi intern jaguar day jaguar leap river pursuit caiman brazil pantan imag archiv,7498
2023-11-29 21:15:00,634,12,"{'like': 634, 'love': 21, 'care': 8, 'haha':0, 'wow': 3,'sad':0,'angry':0}",666,,,https://www.nationalgeographic.com/travel/article/photo-story-chasing-the-northern-lights-in-churchill-canada?cmpid=org=nap::mc=social::src=facebook::cmp=editorial::add=fb20231129travel-churchillnorthernlights&linkId=251559832&fbclid=IwAR2SzAeGUCR45ei7_TXD7FBgfhlzs44BkTvDhEn0BizrwJKEzQ7EhICghgA,"In Canada's frigid north, Churchill is home to only 900 residents but draws scientists and adventure travelers from around the globe. ~ NATIONALGEOGRAPHIC.COm Chasing the Northern Lights in Canada's polar bear capital. In Canada's firgid north, Churchill is home to only 900 residents.",18,https://facebook.com/natgeo/posts/897234058440692,Travel,canada frigid north churchil home resid draw scientist adventur travel around globe chase northern light canada polar bear capit canada firgid north churchil home resid,696
2023-11-29 18:15:00,610,20,"{'like': 610, 'love': 50, 'care': 2, 'haha':1, 'wow': 2,'sad':0,'angry':0}",665,,,https://www.nationalgeographic.com/history/article/the-fascinating-history-behind-the-popular-waving-lucky-cat?cmpid=org=nap::mc=social::src=facebook::cmp=editorial::add=fb20231129hist-resurfmanekineko&linkId=251558699&fbclid=IwAR1OqsxQp4_iT5USsWlgNWb4qyGUo1AEPmvXdWT-edyayZsQ_iHKXHU8A4o,"With a raised paw, pointy red ears, and other accessories, maneki-neko have been bringing in luck and prosperity for centuries. And while the iconic statutes have varied origin stories, they all begin in Japan. ~ NATIONALGEOGRAPHIC.COM The fascinating history behind the popular 'waving lucky cat'",76,https://facebook.com/natgeo/posts/897234058440692,History & Culture,rais paw pointi red ear accessori bring luck prosper centuri icon statut vari origin stori begin japan fascin histori behind popular lucki cat,761
2023-11-29 12:15:00,451,5,"{'like': 451, 'love': 18, 'care': 0, 'haha':0, 'wow': 4,'sad':0,'angry':0}",473,,,https://www.nationalgeographic.com/travel/article/best-food-experiences-savoy-france?cmpid=org=nap::mc=social::src=facebook::cmp=editorial::add=fb20231129travel-savoyfrancefood&linkId=251558026&fbclid=IwAR3bvTsFgGKPBEkGffpp_498ScGAKKKveVzYhU6JJOB7fWUvQ83971zJq0w,"From Mont Blanc to the waters of Lac Léman, the historic region has flavors worthy of its scenery. ~ NATIONALGEOGRAPHIC.COM 4 of the best food experiences in Savoy, France",13,https://facebook.com/natgeo/posts/897234058440692,Travel,mont blanc water lac léman histor region flavor worthi sceneri best food experi savoy franc,491
2023-11-29 09:15:00,271,15,"{'like': 271, 'love': 6, 'care': 2, 'haha':1, 'wow': 0,'sad':0,'angry':0}",278,,,https://www.nationalgeographic.com/science/article/vitamin-c-retinol-biotin-skin-care-needs,"Most people only need three things to keep their skin barrier intact-but during the winter, you may need to go beyond just cleanser, moisturizer, and sunscreen. ~ NATIONALGEOGRAPHIC.COM What does your skin actually need? MOst people only need three things to keep their skin barrier intact",13,https://facebook.com/natgeo/posts/897234058440692,Science,peopl need three thing keep skin barrier winter may need go beyond cleanser moistur sunscreen skin actual need peopl need three thing keep skin barrier intact,306
2023-11-29 06:15:00,5900,184,"{'like': 5900, 'love': 2100, 'care': 766, 'haha':5, 'wow': 54,'sad':10,'angry':0}",8900,,https://scontent.fhan14-2.fna.fbcdn.net/v/t42.1790-2/405274195_314640558181314_8816362127736519239_n.mp4?_nc_cat=106&ccb=1-7&_nc_sid=55d0d3&efg=eyJ2ZW5jb2RlX3RhZyI6InN2ZV9zZCJ9&_nc_ohc=m4lrTHTeKtUAX_MkT3Y&_nc_rml=0&_nc_ht=scontent.fhan14-2.fna&oh=00_ ,,"A sanctuary in Indonesia is celebrating the birth of a Sumatran rhino, the most threatened species of rhinoceros in the world.The healthy male calf is the first for his mother, Delilah, as well as his father, Harapan, a male rhino born at the Cincinnati Zoo, officials say.Sumatran rhinos are listed as critically endangered on the International Union for the Conservation of Nature's Red List of Threatened Species. There are only about 30 mature Sumatran rhinos living in the world, all in Indonesia, and their population is decreasing, according to the IUCN.Progress made in recent years is pointing toward the possible survival of the species, researchers say.",677,https://facebook.com/natgeo/posts/897234058440692,Animals,sanctuari indonesia celebr birth sumatran rhino threaten speci rhinocero healthi male calf first mother delilah well father harapan male rhino born cincinnati zoo offici rhino list critic endang intern union conserv natur red list threaten speci matur sumatran rhino live world indonesia popul decreas accord made recent year point toward possibl surviv speci research say,9761
2023-11-29 04:15:00,568,25,"{'like': 568, 'love': 50, 'care': 9, 'haha':1, 'wow': 2,'sad':1,'angry':0}",630,https://scontent.fhan14-4.fna.fbcdn.net/v/t39.30808-6/404671332_896385718525526_7445082065366036712_n.jpg?stp=cp0_dst-jpg_e15_fr_q65&_nc_cat=111&ccb=1-7&_nc_sid=5f2048&efg=eyJpIjoidCJ9&_nc_ohc=dJEWXCnhX5oAX-UcHMJ&tn=zl8CM8dkYkrsNiwA&_nc_ht=scontent.,,https://on.natgeo.com/49WZjQc,"Chronic inflammation in the gut can wreak havoc on the entire body-even the brain, where mental health conditions can be triggered. But we can influence inflammation by what we eat-and don't eat.",63,https://facebook.com/natgeo/posts/897234058440692,Science,chronic inflamm gut wreak havoc entir brain mental health condit trigger influenc inflamm eat,718
2023-11-29 02:38:00,441,9,"{'like': 441, 'love': 11, 'care': 1, 'haha':0, 'wow': 9,'sad':0,'angry':0}",461,,,https://www.nationalgeographic.com/travel/article/tuscan-spa-town-ancient-history-healing,The Italian town of San Casciano dei Bagni is the site of an ongoing archaeological excavation which has uncovered ancient bronze statues buried under centuries-old thermal baths. ~ NATIONALGEOGRAPHIC.COM This Tuscan spa twon offers ancient history and healing waters,49,https://facebook.com/natgeo/posts/897234058440692,Travel,italian town san casciano dei bagni site ongo archaeolog excav uncov ancient bronz statu buri thermal bath tuscan spa twon offer ancient histori heal water,519
2023-11-29 00:15:00,4200,45,"{'like': 4200, 'love': 777, 'care': 22, 'haha':0, 'wow': 24,'sad':1,'angry':0}",5000,https://scontent.fhan14-4.fna.fbcdn.net/v/t39.30808-6/404671332_896385718525526_7445082065366036712_n.jpg?stp=cp0_dst-jpg_e15_fr_q65&_nc_cat=111&ccb=1-7&_nc_sid=5f2048&efg=eyJpIjoidCJ9&_nc_ohc=dJEWXCnhX5oAX-UcHMJ&tn=zl8CM8dkYkrsNiwA&_nc_ht=scontent.,,,"Autumn leaves fall in Starved Rock State Park in Illinois, USA in this image from our archives.",257,https://facebook.com/natgeo/posts/897234058440692,History & Culture,autumn leav fall starv rock state park illinoi usa imag archiv,5302
2023-11-28 21:06:00,878,12,"{'like': 878, 'love': 36, 'care': 4, 'haha':3, 'wow': 15,'sad':4,'angry':0}",878,,,https://www.nationalgeographic.com/animals/article/photo-ark-names-15000th-species-the-miami-tiger-beetle,"The beetle was rediscovered in 2007 after a more than 60-year absence. Now, planned development is threatening its existence. ~ NATIONALGEOGRAPHIC.COM Meet the Miami tiger beetle, the 15,000th species in Nat Geo's Photo Ark",25,https://facebook.com/natgeo/posts/897234058440692,Animals,beetl rediscov absenc plan develop threaten exist meet miami tiger beetl speci nat geo photo ark,915
2023-11-28 18:15:00,909,24,"{'like': 909, 'love': 74, 'care': 4, 'haha':1, 'wow': 9,'sad':0,'angry':0}",996,,,https://www.nationalgeographic.com/travel/article/all-the-light-we-cannot-see-saint-malo-novel-tv,"Nearly annihilated during World War II, Saint-Malo has long been a beacon of maritime adventure-and potent rebellion. Here's how to experience it. ~ NATIONALGEOGRAPHIC.COM In this French seaside town, discover the different places in 'ALll the Light We cannot See'",63,https://facebook.com/natgeo/posts/897234058440692,Travel,nearli annihil world war ii long beacon maritim potent rebellion experi french seasid town discov differ place light see,1083
2023-11-28 12:15:00,1000,28,"{'like': 1000, 'love': 72, 'care': 4, 'haha':2, 'wow': 33,'sad':1,'angry':0}",1100,,,https://www.nationalgeographic.com/history/history-magazine/article/china-terra-cotta-warriors-made-by-army-artisans,"Discovered in the 1970s, the terra-cotta army was created 2,200 years ago to protect China's first emperor in the afterlife. ~ NATIONALGEOGRAPHIC.COM HOw were China's legions of terra-cotta warriors made? Experts have peiced it together.",56,https://facebook.com/natgeo/posts/897234058440692,History Magazine,discov armi creat year ago protect china first emperor afterlif china legion warrior made expert peic togeth,1184
2023-11-28 09:15:00,529,28,"{'like': 529, 'love': 5, 'care': 2, 'haha':1, 'wow': 9,'sad':2,'angry':2}",549,,,https://www.nationalgeographic.com/environment/article/el-nino-la-nina,"El Niño events generate complex weather patterns every two to seven years that cause drastic and sometimes dangerous changes in weather. Here's what causes them, how they can affect you, and why they're so hard to predict.~ NATIONALGEOGRAPHIC.COM What is El Nino-and will it lead to more snow this winter?",56,https://facebook.com/natgeo/posts/897234058440692,Environment,el niño event gener complex weather pattern everi two seven year caus drastic sometim danger chang weather caus affect hard el lead snow winter,633
2023-11-28 06:15:00,2800,67,"{'like': 2800, 'love': 323, 'care': 113, 'haha':0, 'wow': 40,'sad':253,'angry':12}",3500,,https://scontent.fhan14-2.fna.fbcdn.net/v/t42.1790-2/405274195_314640558181314_8816362127736519239_n.mp4?_nc_cat=106&ccb=1-7&_nc_sid=55d0d3&efg=eyJ2ZW5jb2RlX3RhZyI6InN2ZV9zZCJ9&_nc_ohc=m4lrTHTeKtUAX_MkT3Y&_nc_rml=0&_nc_ht=scontent.fhan14-2.fna&oh=00_ ,,"The pronghorn's annual migration route has existed since prehistoric times, but modern developments have made the journey more difficult.",286,https://facebook.com/natgeo/posts/897234058440692,Travel,pronghorn annual migrat rout exist sinc prehistor time modern develop made journey difficult,3853
2023-11-28 04:23:00,675,292,"{'like': 675, 'love': 9, 'care': 27, 'haha':2, 'wow': 74,'sad':19,'angry':2}",807,,,https://www.nationalgeographic.com/premium/article/frozen-shoulder-menopause-hormones,The painful affliction known as adhesive capsulitis can last for years-but has long been ignored by medical researchers who doubted its existence. New treatments may finally promise a cure. ~ NATIONALGEOGRAPHIC.COM Frozen shoulder is a real condition-and it mostly affects women,139,https://facebook.com/natgeo/posts/897234058440692,Science,pain afflict known adhes capsul last long ignor medic research doubt exist new treatment may final promis cure frozen shoulder real mostli affect women,1238
2023-11-28 02:15:00,732,7,"{'like': 732, 'love': 54, 'care': 4, 'haha':0, 'wow': 5,'sad':0,'angry':1}",795,,,https://www.nationalgeographic.com/travel/article/what-its-like-to-visit-the-swiss-mountains-in-winter,"Clean, efficient, and spectacularly beautiful, many Swiss ski resorts began life as mountain towns where winter sports were a way of life. ~ NATIONALGEOGRAPHIC.COM What it's liek to vist the Swiss mountains in winter",24,https://facebook.com/natgeo/posts/897234058440692,Travel,clean effici spectacularli beauti mani swiss ski resort began life mountain town winter sport way life liek vist swiss mountain winter,826
2023-11-28 00:15:00,5100,109,"{'like': 5100, 'love': 1000, 'care': 544, 'haha':7, 'wow': 23,'sad':86,'angry':2}",6800,https://scontent.fhan14-4.fna.fbcdn.net/v/t39.30808-6/404671332_896385718525526_7445082065366036712_n.jpg?stp=cp0_dst-jpg_e15_fr_q65&_nc_cat=111&ccb=1-7&_nc_sid=5f2048&efg=eyJpIjoidCJ9&_nc_ohc=dJEWXCnhX5oAX-UcHMJ&tn=zl8CM8dkYkrsNiwA&_nc_ht=scontent.,,,"A lost baby elephant calls for its mother in Samburu National Reserve, Kenya in this image from our archives.",251,https://facebook.com/natgeo/posts/897234058440692,Travel,lost babi eleph call mother samburu nation reserv kenya imag archiv,7160
2023-11-27 21:15:00,1700,59,"{'like': 1700, 'love': 296, 'care': 11, 'haha':0, 'wow': 47,'sad':0,'angry':0}",2100,,,https://www.nationalgeographic.com/animals/article/betta-fish-photography-bangkok-visarute-angkatavanich,"A twirling dancer, a bird in flight? Through a photographer's lens, this popular pet becomes a fantasy in fins. ~ NATIONALGEOGRAPHIC.COM See the flamboyant grandeur of the common betta fish",109,https://facebook.com/natgeo/posts/897234058440692,Animals,twirl dancer bird flight photograph len popular pet becom fantasi fin see flamboy grandeur common betta fish,2268
2023-11-27 18:15:00,594,22,"{'like': 594, 'love': 41, 'care': 1, 'haha':3, 'wow': 0,'sad':0,'angry':0}",638,,,https://www.nationalgeographic.com/travel/article/guide-los-angeles-california-latin-american-roots,"Los Angeles has roots in Latin America and is shaped by its influence at every turn. Here's how to explore it. ~ NATIONALGEOGRAPHIC.COM A guide to Los Angeles, the cinematic Califronian city with Latin American roots",16,https://facebook.com/natgeo/posts/897234058440692,Travel,lo angel root latin america shape influenc everi turn explor guid lo angel cinemat califronian citi latin american root,676
2023-11-27 12:15:00,630,410,"{'like': 630, 'love': 17, 'care': 23, 'haha':73, 'wow': 23,'sad':228,'angry':2}",995,,,https://www.nationalgeographic.com/premium/article/svalbard-climate-change-seasons-photography-feature,"Melting fjords, increasing avalanches, imperiled wildlife. Our photographer documented the effects of climate change through all four seasons in Svalbard, Norway. ~ NATIONALGEOGRAPHIC.COM See what a year looks like in Svalbard, Norway, the fastes-warming place on Earth",54,https://facebook.com/natgeo/posts/897234058440692,Environment,melt fjord increas avalanch imperil wildlif photograph document effect climat chang four season svalbard norway see year look like svalbard norway place earth,1459
2023-11-27 09:15:00,406,8,"{'like': 406, 'love': 10, 'care': 0, 'haha':0, 'wow': 1,'sad':0,'angry':0}",416,,,https://www.nationalgeographic.com/travel/article/national-geographic-traveller-uk-hotel-awards-2023,"National Geographic Traveller UK scoured the planet to bring you the best new and improved hotels, from a beachside pad in Sri Lanka to a mountain lodge in Norway.",7,https://facebook.com/natgeo/posts/897234058440692,Travel,nation geograph travel uk scour planet bring best new improv hotel beachsid pad sri lanka mountain lodg norway,431
2023-11-27 06:15:00,9700,306,"{'like': 9700, 'love': 1700, 'care': 110, 'haha':114, 'wow': 1400,'sad':4,'angry':1}",13000,,https://scontent.fhan14-2.fna.fbcdn.net/v/t42.1790-2/405274195_314640558181314_8816362127736519239_n.mp4?_nc_cat=106&ccb=1-7&_nc_sid=55d0d3&efg=eyJ2ZW5jb2RlX3RhZyI6InN2ZV9zZCJ9&_nc_ohc=m4lrTHTeKtUAX_MkT3Y&_nc_rml=0&_nc_ht=scontent.fhan14-2.fna&oh=00_ ,,Listen: The grasshopper mouse howls at night-like a wolf.,1600,https://facebook.com/natgeo/posts/897234058440692,Animals,listen grasshopp mous howl wolf,14906
2023-11-27 03:15:00,844,22,"{'like': 844, 'love': 87, 'care': 4, 'haha':0, 'wow': 1,'sad':0,'angry':0}",935,,,https://www.nationalgeographic.com/photography/article/how-to-take-photos-underwater,Jennifer Hayes came to photography through science: the desire to sway people toward conservation. Here's her advice for creating powerful imagery under the sea. ~ NATIONALGEOGRAPHIC.COM How to take photos underwater. Jennifer Hayes came to photography through science,21,https://facebook.com/natgeo/posts/897234058440692,Photography,jennif hay came photographi scienc desir sway peopl toward conserv advic creat power imageri sea take photo underwat jennif hay came photographi scienc,978
2023-11-27 00:15:00,8400,207,"{'like': 8400, 'love': 1700, 'care': 81, 'haha':5, 'wow': 139,'sad':3,'angry':1}",10000,https://scontent.fhan14-4.fna.fbcdn.net/v/t39.30808-6/404671332_896385718525526_7445082065366036712_n.jpg?stp=cp0_dst-jpg_e15_fr_q65&_nc_cat=111&ccb=1-7&_nc_sid=5f2048&efg=eyJpIjoidCJ9&_nc_ohc=dJEWXCnhX5oAX-UcHMJ&tn=zl8CM8dkYkrsNiwA&_nc_ht=scontent.,,,"A grizzly bear on the move in the Yellowstone National Park, Wyoming.",517,https://facebook.com/natgeo/posts/897234058440692,Travel,grizzli bear move yellowston nation park wyom,10724
2023-11-26 21:15:00,2500,175,"{'like': 2500, 'love': 453, 'care': 18, 'haha':2, 'wow': 29,'sad':1,'angry':1}",3000,https://scontent.fhan14-4.fna.fbcdn.net/v/t39.30808-6/404671332_896385718525526_7445082065366036712_n.jpg?stp=cp0_dst-jpg_e15_fr_q65&_nc_cat=111&ccb=1-7&_nc_sid=5f2048&efg=eyJpIjoidCJ9&_nc_ohc=dJEWXCnhX5oAX-UcHMJ&tn=zl8CM8dkYkrsNiwA&_nc_ht=scontent.,,,"Crowning a Granada hill, the Alhambra embodies the architectural golden age of Muslim rule on the Iberian Peninsula. Here's the history behind this enigmatic fortress. ",290,https://facebook.com/natgeo/posts/897234058440692,History & Culture,crown granada hill alhambra embodi architectur golden age muslim rule iberian peninsula histori behind enigmat fortress,3465
2023-11-26 18:15:00,321,3,"{'like': 321, 'love': 15, 'care': 2, 'haha':1, 'wow': 8,'sad':0,'angry':0}",347,,,https://www.nationalgeographic.com/travel/article/jonathan-stokes-distilling-marseilles-past-present-and-future,"Photographer Jonathan Stokes spent days getting just the right light for this mirrored shot of the Cathédrale Sainte-Marie-Majeure. ~ NATIONALGEOGRAPHIC.COM How i got the shot:Jonathan Stokes on distilling Marseille's past, present and future",10,https://facebook.com/natgeo/posts/897234058440692,Travel,photograph jonathan stoke spent day get right light mirror shot cathédral got shot jonathan stoke distil marseil past present futur,360
2023-11-26 12:15:00,335,53,"{'like': 335, 'love': 10, 'care': 2, 'haha':5, 'wow': 9,'sad':1,'angry':0}",362,,,https://www.nationalgeographic.com/science/article/hiccups-why-how-to-get-rid-of-them-fish-ancestors,"After millions of years, tens of thousands of years of human problem-solving, and decades of modern medicine, the origin and purpose of hiccups are still largely opaque. ~ NATIONALGEOGRAPHIC.COM Why do we hiccup--and is there a better way to get rid of them?",26,https://facebook.com/natgeo/posts/897234058440692,Science,million year ten thousand year human decad modern medicin origin purpos hiccup still larg opaqu hiccup better way get rid,441
2023-11-26 09:15:00,690,4,"{'like': 690, 'love': 15, 'care': 3, 'haha':0, 'wow': 6,'sad':1,'angry':0}",715,,,https://www.nationalgeographic.com/travel/article/rail-adventure-in-kyushu-onsen-homestays-japan-sugar-road,"Kyushu's trading heritage helped shape Japan. Today, a new rail link from Tokyo makes it easier to explore this lush island. ~ NATIONALGEOGRAPHIC.COM A rail adventure in kyushu: onsen, homestays and sweet treats along Japan's Sugar Road",21,https://facebook.com/natgeo/posts/897234058440692,Travel,kyushu trade heritag help shape japan today new rail link tokyo make easier explor lush island rail adventur kyushu onsen homestay sweet treat along japan sugar road,740
2023-11-26 06:15:00,164000,2300,"{'like': 164000, 'love': 4900, 'care': 593, 'haha':568, 'wow': 2100,'sad':356,'angry':197}",192000,,https://scontent.fhan14-2.fna.fbcdn.net/v/t42.1790-2/405274195_314640558181314_8816362127736519239_n.mp4?_nc_cat=106&ccb=1-7&_nc_sid=55d0d3&efg=eyJ2ZW5jb2RlX3RhZyI6InN2ZV9zZCJ9&_nc_ohc=m4lrTHTeKtUAX_MkT3Y&_nc_rml=0&_nc_ht=scontent.fhan14-2.fna&oh=00_ ,,"Known as the heaviest snake in the world, the green anaconda can weigh up to 300 pounds.",7000,https://facebook.com/natgeo/posts/897234058440692,Animals,known heaviest snake world green anaconda weigh pound,201300
